title,company,location,country,score,url,careers_url,source,description
Staff Software Engineer - Machine Learning,gm,,usa,65.85,https://search-careers.gm.com/en/jobs/jr-202507991/staff-software-engineer-machine-learning/,https://search-careers.gm.com/,selenium:gm,"Staff Software Engineer - Machine Learning, Remote | General Motors Careers Skip to main content We care about your privacy Thank you, your preferences have been updated. By clicking ""Accept All"", you agree to the storing of cookies on your device to give you the most optimal experience using our website. We may also use cookies to enhance performance, analyse site usage and to personalize your experience. Manage Preferences Accept All Only Essential Engineering Staff Software Engineer - Machine Learning Location Remote (+) Show all locations (-) Hide all locations Schedule Full time Posted Dec 20 2025 Job Requisition JR-202507991 Description Role: The Smart Agents group is responsible for building the ML models and system to simulate road users in a variety of situations and generate the scenarios used for testing and training AV driving policies. If you think of Simulation as a video game our autonomous vehicles train on to learn to drive, the Smart Agents team develops the ML/AI models that control the other characters in the video game to interact in realistic ways as the av drives-eg, the other vehicles, bikers, and pedestrians. Our technology stack includes Generative AI models (GPT) and Reinforcement Learning (RL) policies. The Smart Agents group work closely with the rest of the Simulation, and our partners Behaviors, Perception, and Safety Engineers. The specific duties may include ML/RL model development as well as training loop development, streamlining optimization, integration, creating ML infrastructure, metrics, and data pipelines for production model deployment as well as for fast experimentation cycles. What You'll Do: Support the team in developing machine learning (ML) and reinforcement learning (RL) models, including training loop development and optimization. Streamline integration and create ML infrastructure, metrics, and data pipelines for production model deployment and rapid experimentation. Work as part of an ML team and contribute strong software engineering (SWE) expertise. Support the ML team in accelerating project timelines, particularly in areas related to Autopilot, Lane Keep, and autonomous vehicle (AV) technologies. Experience in simulation and robotics is highly desirable, with a preference for candidates from AV or robotics backgrounds rather than solely cloud-focused companies. Your Skills & Abilities: 4+ years of experience in the field of robotics or latency-sensitive backend services Background working with machine learning teams, algorithms, and models Bonus: Experience building highly performant ML and system pipelines Strong programming skills in modern C++ or Python Bonus: Experience with profiling CPU and/or GPU software, process scheduling, and prioritization Passionate about self-driving car technology and its impact on the world Expertise in setting architectures that are scalable, efficient, fault-tolerant, and are easily extensible allowing for changes overtime without major disruptions. Ability to design across multiple systems. Ability to both investigate in sophisticated areas as well as a good breadth of understanding of systems outside of your domain. Ability to wear several hats shifting between coding, design, technical strategy, and mentorship combined with excellent judgment on when to switch contexts to meet the greatest need. Track record in deploying perception/prediction/av models into real world environments Your Skills & Abilities: 4+ years of experience in the field of robotics or latency-sensitive backend services Proven experience in machine learning and classification. Familiar with ML frameworks such as Tensorflow or PyTorch Experience building highly performant ML and system pipelines Strong programming skills in modern C++ or Python Experience with profiling CPU and/or GPU software, process scheduling, and prioritization Passionate about self-driving car technology and its impact on the world Expertise in setting architectures that are scalable, efficient, fault-tolerant, and are easily extensible allowing for changes overtime without major disruptions. Ability to design across multiple systems. Ability to both investigate in sophisticated areas as well as a good breadth of understanding of systems outside of your domain. Ability to wear several hats shifting between coding, design, technical strategy, and mentorship combined with excellent judgment on when to switch contexts to meet the greatest need. Track record in deploying perception/prediction/av models into real world environments Experience working with RL and sequence prediction (ML) models Compensation : The compensation information is a good faith estimate only. It is based on what a successful applicant might be paid in accordance with applicable state laws. The compensation may not be representative for positions located outside of New York, Colorado, California, or Washington. The salary range for this role is $134,000 to $235,900. The actual base salary a successful candidate will be offered within this range will vary based on factors relevant to the position. Bonus Potential: An incentive pay program offers payouts based on company performance, job level, and individual performance. Benefits: GM offers a variety of health and wellbeing benefit programs. Benefit options include medical, dental, vision, Health Savings Account, Flexible Spending Accounts, retirement savings plan, sickness and accident benefits, life insurance, paid vacation & holidays, tuition assistance programs, employee assistance program, GM vehicle discounts and more. Remote: This role is based remotely but if you live within a 50-mile radius of Atlanta, Austin, Detroit, Warren, Milford or Mountain View, you are expected to report to that location three times a week, at minimum. Relocation: This job may be eligible for relocation benefits. #LI-MH2 This role is categorized as hybrid. This means the selected candidate is expected to report to a specific location at least 3 times a week {or other frequency dictated by their manager}. About GM Our vision is a world with Zero Crashes, Zero Emissions and Zero Congestion and we embrace the responsibility to lead the change that will make our world better, safer and more equitable for all. Why Join Us We believe we all must make a choice every day – individually and collectively – to drive meaningful change through our words, our deeds and our culture. Every day, we want every employee to feel they belong to one General Motors team. Total Rewards | Benefits Overview From day one, we're looking out for your well-being–at work and at home–so you can focus on realizing your ambitions. Learn how GM supports a rewarding career that rewards you personally by visiting Total Rewards resources . Non-Discrimination and Equal Employment Opportunities (U.S.) General Motors is committed to being a workplace that is not only free of unlawful discrimination, but one that genuinely fosters inclusion and belonging. We strongly believe that providing an inclusive workplace creates an environment in which our employees can thrive and develop better products for our customers. All employment decisions are made on a non-discriminatory basis without regard to sex, race, color, national origin, citizenship status, religion, age, disability, pregnancy or maternity status, sexual orientation, gender identity, status as a veteran or protected veteran, or any other similarly protected status in accordance with federal, state and local laws. We encourage interested candidates to review the key responsibilities and qualifications for each role and apply for any positions that match their skills and capabilities. Applicants in the recruitment process may be required, where applicable, to successfully complete a role-related assessment(s) and/or a pre-employment screening prior to beginning employment. To learn more, visit How we Hire . Accommodations General Motors offers opportunities to all job seekers including individuals with disabilities. If you need a reasonable accommodation to assist with your job search or application for employment, email us [email protected] or call us at 800-865-7580. In your email, please include a description of the specific accommodation you are requesting as well as the job title and requisition number of the position for which you are applying. Who we are Our Culture Working at GM Driven by innovation and creating an environment to inspire, we embrace the responsibility to make our world better, safer and more equitable for all Total Rewards A better tomorrow begins with you From day one, we’re looking out for your well-being— at work and at home— so you can focus on realizing your ambitions Join our team We're ambitious. We’re committed. And this work is our life’s passion. Ready to start your career path at GM? Let’s get in touch. Explore our career opportunities Get Job Alerts & Company Updates Still thinking about applying? Join our talent community Join our talent community to stay connected with GM careers"
Work #LikeABosch,bosch,,usa,62.5,https://jobs.bosch.com/en/job/REF250374L-equipment-maintenance-technician-supervisor-d-shift-wednesday-friday-every-other-saturday-6pm-6am,https://www.bosch.us/careers/,selenium:bosch,
Lead Materials Industrialization Engineer - Chassis Structure and Suspension Systems,lucid,,usa,57.01,https://job-boards.greenhouse.io/lucidmotors/jobs/4996898007,https://lucidmotors.com/careers,selenium:lucid,"Job Application for Lead Materials Industrialization Engineer - Chassis Structure and Suspension Systems at Lucid Motors Back to jobs Lead Materials Industrialization Engineer - Chassis Structure and Suspension Systems Michigan, United States Apply Leading the future in luxury electric and mobility At Lucid, we set out to introduce the most captivating, luxury electric vehicles that elevate the human experience and transcend the perceived limitations of space, performance, and intelligence. Vehicles that are intuitive, liberating, and designed for the future of mobility. We plan to lead in this new era of luxury electric by returning to the fundamentals of great design – where every decision we make is in service of the individual and environment. Because when you are no longer bound by convention, you are free to define your own experience. Come work alongside some of the most accomplished minds in the industry. Beyond providing competitive salaries, we’re providing a community for innovators who want to make an immediate and significant impact. If you are driven to create a better, more sustainable future, then this is the right place for you. We are seeking a Senior Supplier Industrialization Engineer - Chassis Structure and Suspension Systems to drive best-in-class product quality throughout the development process. This high-visibility role demands technical expertise, strong interpersonal skills, and the ability to excel in a complex, fast-paced environment. The candidate must have experience in the following processes: Chassis Structures (Subframes, Controls Arms, Links, Knuckles): Forming Forging Stamping Extrusion Rolling Machining Casting Sand Casting Die Casting Vacuum Casting Investment Casting Metal Injection Molding Chassis Suspension: Air Suspension Shocks Springs Struts Coil springs Stabilizer links Stabilizer bars Our Corporate Supplier Industrialization team empowers the rapid industrialization of innovative products. The Senior Supplier Industrialization Engineer collaborates with cross-functional teams and suppliers to balance design innovation with robust manufacturing for optimal quality. To succeed, you must possess deep technical expertise in implementing quality and reliability best practices, driving innovation, and ensuring product validation. Candidates must demonstrate exceptional performance, leadership, and the ability to excel in a fast-paced environment. The ideal candidate is proactive, determined, and has a proven track record in quality program management, preferably within the automotive industry. Responsibilities: Develop, manage, and improve the APQP process with suppliers from the initial design stage through PPAP submission and the start of mass production. Lead design review and ensure manufacturing needs (DFM/A) for Chassis structure commodities are considered in the design phase and that proper quality expectations are defined. Be responsible for driving and tracking all Tier suppliers responsible Engineering Design Change activities. Work cross functional with Plant level Manufacturing, Incoming Quality, Material Planning and Plant SQEs to ensure supplier quality issues are contained and Lucid plants are protected. Perform supplier assessments, audits and site inspections for sourcing; develop process improvement plans and drive implementation; monitor and maintain performance metrics Have ability to travel 25-75% on average on a short term or long-term basis to Lucid Motors and supplier sites globally on a short notice. Document processes and compliance with ISO9001 and AIAG/ IATF16949 industry standards. Analyze data from supplier and assembly plant builds to assess capability of meeting requirements to complete the build. You Bring: Bachelor's degree in Mechanical, Materials, or Industrial Engineering. Minimum 8 years of experience in high-volume manufacturing or assembly plant environments within Supplier Quality, Quality Engineering, R&D, or Manufacturing Engineering. At least 6 years of hands-on APQP and PPAP project management. Proficiency in reading and interpreting schematics and drawings. In-depth knowledge of chassis quality standards and specifications. Comprehensive understanding of product quality lifecycle stages and associated quality gates. Proficient analytical skills, technical writing proficiency, and mastery of quality tools (IATF 16949, APQP, PPAP, SPC, MSA, FMEA, DOE, DFM/A, GD&T). Proven ability to collaborate effectively, leverage data, and innovate solutions. Demonstrated adaptability, a positive attitude, and a strong problem-solving orientation. Proficient verbal and written communication skills with a focus on timely delivery. Team player with interpersonal skills, hands-on and data-driven, creative mindset in problem-solving. Positive attitude, willingness to learn, be part of the solution and be able to adapt to the dynamic working environment. Advanced skills in Microsoft Excel , Word, and PowerPoint . Working knowledge of Smartsheet, JMP, Minitab, JIRA and Tableau is a plus. Preferred Qualifications: Master’s degree in Engineering. Automotive industry experience. Certification - American Society for Quality, Six Sigma Black Belt, etc. Additional Compensation and Benefits : Lucid offers a wide range of competitive benefits, including medical, dental, vision, life insurance, disability insurance, vacation, and 401k. The successful candidate may also be eligible to participate in Lucid’s equity program and/or a discretionary annual incentive program, subject to the rules governing such programs. (Cash or equity incentive awards, if any, will depend on various factors, including, without limitation, individual and company performance.) By Submitting your application, you understand and agree that your personal data will be processed in accordance with our Candidate Privacy Notice . If you are a California resident, please refer to our California Candidate Privacy Notice . To all recruitment agencies : Lucid Motors does not accept agency resumes. Please do not forward resumes to our careers alias or other Lucid Motors employees. Lucid Motors is not responsible for any fees related to unsolicited resumes. Apply for this job * indicates a required field First Name * Last Name * Email * Phone Country * Phone * Location (City) Locate me Resume/CV * Attach Attach Dropbox Google Drive Enter manually Enter manually Accepted file types: pdf, doc, docx, txt, rtf Cover Letter Attach Attach Dropbox Google Drive Enter manually Enter manually Accepted file types: pdf, doc, docx, txt, rtf Education School Select... Degree Select... Discipline Select... Start date year End date month Select... End date year Add another LinkedIn Profile How did you learn about this opportunity? * Select... Are you a current contractor for Lucid, or any of its entities? * Select... Have you previously worked for Lucid, or any of its entities, as a contractor? * Select... What is your highest level of education completed? * Select... Are you currently authorized to work in the United States of America? * Select... Do you now or in the future require visa sponsorship? * Select... We may reach out to you via text message (SMS) during the interview process. Do you approve of us contacting you via text message? * Select... U.S. Standard Demographic Questions We invite applicants to share their demographic background. If you choose to complete this survey, your responses may be used to identify areas of improvement in our hiring process. How would you describe your gender identity? (mark all that apply) Select... How would you describe your racial/ethnic background? (mark all that apply) Select... How would you describe your sexual orientation? (mark all that apply) Select... Do you identify as transgender? (select one) Select... Do you have a disability or chronic condition (physical, visual, auditory, cognitive, mental, emotional, or other) that substantially limits one or more of your major life activities, including mobility, communication (seeing, hearing, speaking), and learning? (select one) Select... Are you a veteran or active member of the United States Armed Forces? (select one) Select... Voluntary Self-Identification For government reporting purposes, we ask candidates to respond to the below self-identification survey. Completion of the form is entirely voluntary. Whatever your decision, it will not be considered in the hiring process or thereafter. Any information that you do provide will be recorded and maintained in a confidential file. As set forth in Lucid Motors’s Equal Employment Opportunity policy, we do not discriminate on the basis of any protected group status under any applicable law. Gender Select... Are you Hispanic/Latino? Select... Race & Ethnicity Definitions If you believe you belong to any of the categories of protected veterans listed below, please indicate by making the appropriate selection. As a government contractor subject to the Vietnam Era Veterans Readjustment Assistance Act (VEVRAA), we request this information in order to measure the effectiveness of the outreach and positive recruitment efforts we undertake pursuant to VEVRAA. Classification of protected categories is as follows: A ""disabled veteran"" is one of the following: a veteran of the U.S. military, ground, naval or air service who is entitled to compensation (or who but for the receipt of military retired pay would be entitled to compensation) under laws administered by the Secretary of Veterans Affairs; or a person who was discharged or released from active duty because of a service-connected disability. A ""recently separated veteran"" means any veteran during the three-year period beginning on the date of such veteran's discharge or release from active duty in the U.S. military, ground, naval, or air service. An ""active duty wartime or campaign badge veteran"" means a veteran who served on active duty in the U.S. military, ground, naval or air service during a war, or in a ca"
